creator,poem
0,"On a fine morning, she died
–like in the chick flicks, and ‘don’t-know-how-to-end-it’ romance novels.
Like her, It was a rare disease that took her by surprise,
It wasn’t her choice – it would never be
had she had the chance.
This was her first and only time she fought and lost a fight.
‘cause she always got what she asked for – even in love,
Her eyes were the first to sparkle, and ask and that’s how it started between us.
I wouldn’t lie –Looks did play a part – she was gorgeous, and after we fell in love,
She was the most gorgeous woman in the world – even when she was laid to rest.
We began to talk all the world we knew,
and with surprisingly’ Born & Lost & found again’ twin- like qualities,
we both regretted that we had lost a hell lot of time -
From the cradle itself – and we had to make up for all of it
And spend every moment we got –together.
She: 'Are we silly? '  Me: 'No, We are beautiful people! '
We had made, lots of plans –
Unspoken and yet we both knew.
‘cause we believed in dream lands and Wuthering Heights
Ancient Classics on the radio, poetry, Victorian novels and less television,
More moments together in silence, deeply smitten;
In all, we wanted ours to be, the best love story ever written.
We bought little gifts from whatever change we had in our pockets,
Strange items from the 1$ store –an Angel made in China
– targeted at us types – sold, accepted with a smile;
musical greeting cards –which got me my first kiss,
and I started to give her a card every day;
and roses that were always not fragrant or fresh enough.
Remember Love letters? – There was always something to write,
exclusively handwritten with a fountain ink pen on paper – folded,
posted into a large red box called the post-box;
and we waited in thrill to read our letters that reached us a day later...
–we  had all the time of our lives.
We were both often tongue-tied to say anything at all
after a ‘hello’ on the phone.
Her voice did that to me,
and she claimed that my boorish grumble  did that to her as well.
And..there was getting drenched in the drizzle...
–blame our books if you want to,  we wouldn’t;
Our Picnics in the meadows, home made cookies (her mom made them) ,
Sipping green tea and watching the clouds pass by.
As time flew and we noticed,
we now talked about the right time to get together-
To turn the house i owned into our ideal home - that’s thankfully hard to locate
by our ‘convenience, cash-borrowing sake’ friends;
‘Cause we were selfish, and we wanted each other for several more years.
In a so called modern world where everything and anything old worldy
was not in anymore,
We laughed at the diabetes epidemic that infected the cultured minds,
And we happily indulged in the sickeningly sweet ways;
-We didn’t give a damnation. “Jealousy! ” She remarked. I agreed.
We spoke the same words; and rarely thought or talked differently,
‘Cause - She was me and I was She.
In all,  the ‘uncool and unreal’ stuff on hallmark channel
–suspended reality of today based on Lost values, Frozen in time
and Memory (again, an old line)    -
We believed in the old fashioned thing called Love. - Pity you!
After her death, it was like the end of times,
like in the books;
Birds sang sad songs;
The little squirrel that came down for bread crumbs waited for her
And left disappointed; the flowers drooped their heads in mourning for a few days
– so, It was all real!
I snapped out of it all, and brought the world back on its feet,
The world needs to go on, in spite of me.
The life that used to be for us and around us, came back to life.
As comforting words stopped from friends;
I continue to live with her- her memory,
And I begin to build the dream home we wanted
Slowly she started to appear,
No apparition, or ghoul or ghost  - but actually her
As she quietly watched and smiled, and was all around when our home
Came to life.
The chrysanthemums and tulips for the garden;
Bird baths and bird houses;
A French window that opened into the woods;
No electric fencing ‘cause it’s dangerous for the animals;
No bloody television – the outside world doesn’t change for good in 24 hours,
and the morning paper was enough;
Ah.. the fireplace – the moments we shared, just looking deep into the fire
In deep embrace, feeling the warmth and our hearts beating together
To the sounds of wood splinter and crackle – i retained the fireplace as it was.
She wanted her own black beauty – a gorgeous stallion
and a pickup truck; our dreams grew on and we had to work harder -
to bring our picture post card aspirations to life.
A loan that will help take lease of the used books store in town and turn it into a library
- our humble idea to have a regular supply of titles.
We were always realistic in our world – believing, hoping and loving.
We could open the books and relive the stories again,
Dream the lost dreams-channels have re-runs, don’t they?
I got it all happening, God’s grace,
‘cause we would never like our dreams to fail,
while I still run the bakery – going on the same way.
The pastries are missing something – customer complaints
for which I know the answer
but cannot explain the ‘missing ingredient’ to them.
We never kept diaries, ‘cause we remembered whatever that mattered to us
and that was enough.
Her dreams, our dreams and our life was all that mattered – love mattered.
And that was enough.
Conversations happen now and then
with the people I occasionally bump into and
as usual, they talk as though they were always there to care –
Them: “Are you seeing someone again? You have to move on! ”
Me: “Sorry! Wherever I go, She goes.”
“I shan’t betray her memory! I feel her in the wind when I walk;
“I feel her, see her in everything I touch”;
I feel her comforting me, giving me company in my aloneness! ”
I would live and die as her beau! ”
Them: Frowns. “They were never in touch with reality! ”
“Thank you. For once we agree, I didnt believe in your reality.”
We never asked anyone to believe us or in what we believed in.
I continue to dream and  build our home
-The fire had died out, but the warmth hasn’t.
The winds still carry her beautiful songs,
They might bring them back to me after every bird has learnt it.
I wake up in the morning, and look first at her face,
Her eyes closed in sleep, and the little smile on her face,
I can feel she’s still dreaming.
The books we really loved always ended
with ‘Then, they lived happily ever after.”
We are living, happily, ever after."
0,"(free verse)* Not Suitable For Limericks #2
Today's children might be less spoiled if we could
spank their parents
I'm as confused as a baby in a topless bar
You should never put a child in Superman
pajamas in a top bunk
For good... return good
For evil... call Batman
* (free verse... prose on a poem site)"
0,"Desire
Lips sealed with a kiss
Lips parted for more
Don't you know my love
Desire for ever more
The saga of ancient lore
Maya (Illusion)    In Nature
I am the Eve of your Garden
Defamed by fate's cruel hand
I bore you in me as a thought beautiful
Carry the energy per your command
I am but the executrix of your deeds."
0,"Free verse
Push my nail in skin while reading
What is this?
We have burned rhymes, meters!
No Secrets
Yet shameless we insist ‘is poem'
Junk poems
""Baby pissed"", ""The bird hissed""
Write or say
Empty is nonsense; or worthless
Time wasted
Does it have a message?
Will it be ambiguous?
Where is the beauty?
Where's softness?
It is exact; the tattoo of Rumi:
""Oh it hurts""
""This later""
""Not here'
And it ends:
""Has ever been lion without head, no tummy and no tail? """
0,"Late in the afternoon over the sea
the day poured out the last out of its wineglass,
the bay, the wave is coloured red
when on the beach you do kiss me.
Next to the coast our love lays step upon step,
at high tide the moon is beautiful to you,
our castles lie scattered on the sand
when water in and out wiping all things of us clear.
The stars stretch almost unending wide,
the lighthouse at Danger Point limps on and off
and you find God's poetry in the night,
tell that in the universe a struggle rages,
far away dogs are barking continually
and in the moonlight your face glows softly.
© Gert Strydom"
0,"(after C. M. van der Heever)
The orange-red moon rises as if it is sailing in the sky
where the last rays of the sun do disappear
and the long row of oak trees are etched in their outlines
as if the sun is still writing its last message
before the darkness totally absorbs the last light
while blue-white the evening star do already shine
and predators hunt to survive in the death and pain of others
while crocodiles and hippopotamuses come out with their clumsy bodies
and there is a fine balance between life and death
that hangs over the whole earth like a web
while birds of prey do glide in the darkness
and like this everything in a way is caught
even man who do strive as a higher being
to noble things and also to his own interest.
[Reference:""Lewe en dood"" (Life and death)by C. M. van der Heever.]
© Gert Strydom"
0,"With Love, Time is not
Nor space and distance matter
Ribboned passion in a knot
One loving heart tied with the other.
With Love,  Age is not
Nor even Status break attraction
Kings give up thrones, and all of that
For his lady love's deep affection.
With Love,  Race is  not.
For Color fades in Cupid's arrow
It conquers all,  no matter what
Blind to the sight  is what lovers know."
0,"She is Tom
Tom pet,
Pet cat,
She was born in 2015
On March 7,
In coming March she will be 3
Yet she has no kitten;
She is not a normal cat,
She does not bear any cat
She is fond of living with human;
Though she is pet,
She lives independently;
She does not like to obey commands
Her motives are often unknown, ........
Copyright © Muzahidul Reza │ 14 December,2017"
0,"I admire all the aims of Free Verse,
In all I write rightly explicit
Regardless of stress and of meter
And with Capital Letters to boot.
One onwards plods petty, proasic,
Even worse, with linguistic abuse,
As for spelling, why, rules and times changing,
No core...erections once inked I think fair.
Terpsichore would be dumb could not dance,
Prose to accent and scansion stays deaf,
While to harmony all seems averse
Calls on cue for vain ego's applause.
Free Verse tractor drives, pastures green
Are ploughed to prepare literary
Slums which spurn mental gymnastics
Burning faith in fair future hopes held.
'There is no poetry in money,
No money in poetry' either,
As returns fall returns must increase,
Squeezing readers', booksellers' illusions.
This rant could continue for years
with cadence most messy maintained,
with readership bored into tears...
Oops! There's rhyme unintended! Oh curse!
©  Jonathan Robin - written 21 December 2007 - see Paul Verlaine, Vers Libres and  JR  Free Verse below
Free Verse - Translation Paul Verlaine Vers Libres
I admire all the aims of Free Verse,
‘tis explicit in all that I do
in shaping the stress to converse
with a rhyme-scheme restricted to two.
That I stay with this number is true, -
a linguistic abuse, maybe worse,
how it weighs and encumbers the view! -
but French art needs its aid, though perverse.
Else the Muse would be dumb to a curse,
for to accent, the lingo’s deaf too, -
though what can one do?  All’s averse
to fantasy rhyme calls on cue!
May Free Verse’s aims bring joy unto
the young sparks who chance meanings coerce -
whose mental gymnastics’ fun value
is the fire to inspire hopes they’d nurse.
They’re young colts who green pastures traverse
with gravity worthy their virtue,
though mad they’re superb, and no hearse
they’d inherit! Free Verse tempts! You too?
© Jonathan Robin - Poem written 19 June 1991
Translation Paul VERLAINE - see below Vers Libres
Vers Libres
J’admire l’ambition du Vers Libre, -
Et moi-même que fais-je en ce moment
Que d’essayer d’émouvoir l’équilibre
D’un nombre ayant deux rhythmes seulement?
Il est vrai que je reste dans ce nombre
Et dans la rime, un abus que je sais
Combien il pèse et combien il encombre,
Mais indispensable à notre art français.
Autrement muet dans la poésie,
Puisque le langage est sourd à l’accent.
Qu’y voulez vous faire? Et la fantaisie
Ici perd ses droits: rimer est pressant.
Que l’ambition du Vers Libre hante
De jeunes cerveaux épris de hazards!
C’est l’ardeur d’une illusion touchante.
On ne peut que sourire à leurs écarts.
Gais poulains qui vont gambadant sur l’herbe
Avec une sincère gravité!
Leur cas est fou, mais leur âge est superbe.
Gentil vraiment, le Vers Libre tente!
Paul VERLAINE 1844_1896 Epigrammes"
0,"When sunsets for night sorrow drifts in, whispering through the trees.
Her gown flutters through the air  as she glides over me.
Setting quietness throughout the land,
In a dangerious whisper that gave me shivers.
The despair settled over me, as her calming deadly wrath,
Wrapped me in a blanket of sadness."
0,"Long day at school,
Dark and gloomy
.Everyone is pulling my last nerve,
The nerve that can not stretch no more.
I’m all out of drugs, marijuana, cocaine,
O well the weren’t helping any way.
Why do I take them, I don’t understand
My level is still the same.
I open the door to this dump of a room,
Finding the nearest knife
The darkest corner is never here
In the day time it’s all light
I sit on my bed,
Making regretting scars
On the vein that I have last
Redness appears,
But that’s just the stress that I deal with in a day I
’m bullied and tossed all over the field,
Acting like I don’t care
The colours of the rainbow are changing for me,
From brightness to grey
Now, I’m bleeding all over the floor
But the real pain hurts inside
The hearts that’s broken can’t beat without you,
Bearing to stay apart.: ("
0,"(free verse) * A Great Grandfather's Lament
I have children
and they have children
and one of those children has a child
but no one writes to me
not even Daemon (who is almost three)
And I am not even Jewish
(so what am I... chopped liver?)
* free verse... prose on a poem site"
0,"Weavers do twitter, warblers chirp and doves coo
and the summer overflows with joy
but for the cat that do try to murder the birds
where from the branches of the fig tree the birds peep
and in the days of the summer I am swept away
by all of the birds that so cheerful do sing in their choir
and do notice them splash and drink at the water bowl
when they do flutter down and I do feed them crumbs
and every bird does sing an own love-song
that continually does sound up with joy
as if all of creation do enjoy this summer,
the birds land as if the fruit trees do beckon them,
know that they do offer seed and fruit to them
and I can think of no other better summer."
0,"(for Annelize, after I. D. du Plessis)
Your love is a pure light
that radiates my whole world
and you do love me intimately
when you do determine holy times for me,
where every word and deed
like nard do flow over me,
where constantly you do leave me speechless
where you do sacrifice yourself and do bleed,
do constantly treat me with great respect,
do overwhelm me with the person that you are
without me asking for any of this
as if you are acting in an unspoken secret way
and in your silent submission where you do serve me
it is the core of love that I do witness.
[Reference:""Die vlam"" (The flame)by I. D. du Plessis.]
© Gert Strydom"
0,"(for Annelize)
You are the one that I do trust with all my secrets
above all other women you are utter beautiful to me,
wonderful even when you do turn my world upside down,
you are the fortress that I do build against the world,
in the silent moments I think about you
and even if the black-collard barbet twitters the day red,
even if the frost of life is spread out everywhere
I pray to God to hold His hand over you,
heroic as a warrior you stand at my side,
are not blinded by the insanity of gossip
but it's with sincere love that you do come to me
where you are vulnerable but also a heroine to me
and I trust in our love and on God like a child
when day after day you astonish me with your humanity.
© Gert Strydom"
0,"The Free Verse
(Two Pairs of Couplets●Seven Words of Quatrain)
The landscape painting, moon lies at anchor in the lake light
The free verse, clouds stay mountains and plains
In the pond, water warm and lotus in early bloom
In the dream, feel sad, sober up late
2017/6/8/罗志海写诗翻译
On June 8,2017, by Luo Zhihai, Poetry and Translation
◆ Chinese Text
自由诗
(对联体●七绝)
月泊湖光风景画
云栖山野自由诗
池中水暖荷开早
梦里心酸 酒醒迟"
0,"(free verse) Here's A Bowl
To mix a salad in, Paladin
They say it contains the deepest despair
It's a Tiffany... Isn't it spiffany?
If you 'ping' it, it will echo most valiantly
Full of a mixture of daisies and crazies
For a goldfish (not just any old fish)
On a note pre-destinate
how many budgies could make a nest in it?
Now let's go peer into a cup..."
0,"(free verse) *Not suitable for limericks #4
I can always tell when my wife has had enough to drink...
her face gets blurry
They say alcohol is a slow poison...
but hey!who's in a hurry?
Two nuns approach a drunk.One passes on the right
and the other passes on the left.
He whips around: ""How did you do that? ""
Don't drink and drive.
You're liable to hit a bump and spill your drink.
*(free verse... prose on a poem site)"
0,"My today is laughing
Yesterday crying
But I will face tomorrow,
I am time
I go on and on
You won't find me looking behind.
Copyright © Muzahidul Reza |11/22/2016"
0,"(after I. D. du Plessis, in answer to N. P. van Wyk Louw)
Motionless like skeletons the branches hang stripped, the summer is past,
the air is stuffy and the clouds are grey and black and heavy,
the wind rustles through the dry earth grabs here and there a leave,
etched against the dark sky stands the gigantic oak trees in a long row
where you get an impression of the eternal waiting of trees,
of the winter that is coming with the first chill of the fall
but still the doves do sing their love songs where they do woo
when swarms of other birds do trek away to avoid the iciness,
where the sun does break through at place after place but still hangs dull dying,
the oaks gleam dull black, do gigantic stick their fingers into the sky,
while the grassy veldt yellow-brown do stretch into the distance
when a person does long back to the fruitful days of summer
and do find God in the silence of the resting time that suddenly does come
when the first snow does cover the peaks of the Hottentots Holland Mountains.
[References:""Herfs"" (Autumn)by I. D. du Plessis.""Vroegherfs"" (Early Autumn)by N. P. van Wyk Louw.]
© Gert Strydom"
0,"it amuses an
observant layman
to know
critical university
lecturers
opinionated
upon superficial
snippet examinations
using syntactical
grammatical dissection
methods analytical
could not cannot discern
discover key simple
poetic rules followed
free verse values paramount
theme impact over rigid rhyme
Copyright © Terence George Craddock"
0,"Dewdrops hang like diamonds on the web and sparkle in the light
where a small black spider do wait patiently for an insect,
between prickly pears, in this construction the weight of the spider rests
when the sun rise over the horizon in an open new day.
The girl Arachne dares to challenge the goddess Athena to weaving
and where Athena makes a tapestry of the gods in their splendour,
the fine work of Arachne of their romances is lovelier,
where Athena tears that piece of art to shreds according to the old story
Arachne hangs herself on the strings for life and death
where she views herself equal to Athena and do to eternity spin webs,
as a spider having to catch insects for a life
and still do hang in her rebellion against the gods on her web
from where she does daily look upon Athena in arrogance
and keeps herself eternally cursed as a prisoner of her own will.
© Gert Strydom"
0,"You are like a beautiful feather
That flutters upon a gentle breeze
I stand in silent wonder trying to
Not disturb your fragile journey
I bend down and kiss your forehead
And whisper in your ear ever so softly,
“You are as brilliant and inspiring as the
Dawning sun, for when I gaze at you
The darkness of the world fades away
Into nothingness; and is replaced by
Your warm and pure luminous beauty.”"
0,"I now delight
In spite
Of the might
And the right
Of classic tradition,
In writing
And reciting
Straight ahead,
Without let or omission,
Just any little rhyme
In any little time
That runs in my head;
Because, I’ve said,
My rhymes no longer shall stand arrayed
Like Prussian soldiers on parade
That march,
Stiff as starch,
Foot to foot,
Boot to boot,
Blade to blade,
Button to button,
Cheeks and chops and chins like mutton.
No! No!
My rhymes must go
Turn ’ee, twist ’ee,
Twinkling, frosty,
Will-o’-the-wisp-like, misty;
Rhymes I will make
Like Keats and Blake
And Christina Rossetti,
With run and ripple and shake.
How pretty
To take
A merry little rhyme
In a jolly little time
And poke it,
And choke it,
Change it, arrange it,
Straight-lace it, deface it,
Pleat it with pleats,
Sheet it with sheets
Of empty conceits,
And chop and chew,
And hack and hew,
And weld it into a uniform stanza,
And evolve a neat,
Complacent, complete,
Academic extravaganza!"
0,"no matter how much it seems to hurt,
it happens again and agian
tears are running down my cheeks,
saying that i'll regret this.
no matter what happens,
i'm always alone.
with no one on my side,
but i'm not alone,
others do the same.
what will happen when we are done?
with nothing left,
my heart cries out, unknowingly,
with no reason for misery.
it's like the death of an angel,
all over agian,
in the silent screams i hear."
0,"(free verse) Awful Lonely Here Folks
My support on poemhunter is next to nilI will take a month off and maybe start again in FEB 2019For those few who will miss me.. sorrythere is not enough to make it worth the effort.My other site Allpoetry I will continue as usual.
Wes Vogler Old DadBabbling Books DEC 26 2018"
0,"What is free verse! ? What is free verse! ?
I'll tell yer what's free verse!
Free verse? That's when the poet gets nuffink!
Not a penny, not a sausage for his poem...
He spent hours on that poem, yeah, hours...
Nobody spent a penny on buying his poem.
He had to pay for his home and his car.
He had to pay for his family's food and clothes.
He had to pay for his paper and pen and typewriter.
He had to pay for his computer and his printer.
He had to pay electricity, water and gas bills.
He had to pay VAT and the terrible TV licence tax.
He had to pay for his phone line rental and Broadband.
He had to pay for every flipping thing!
Nobody else helped him. Nobody sponsored him.
Free verse? That's what poets share with skinflints!
Yeah, that's what free verse is. It's free...
But it's won too free if you ask me!
Denis Martindale April 2017."
0,"He walks alone,
In misery of others.
Hiding in the shadows,
Of the schools walls.
When reaching a trip home,
Swallowing what’s called a drug,
There are always different kinds.
A fierce battle is fought when he gets home,
More loss’s than wins
Against his parents.
For them he is nothing,
Just what they have produced.
16, but money is what they dread to give.
Topple over to his room; find a corner that’s dark.
Blood gushing out, from a cut that he’s made
Revealing they stress, for that single day
Why is he different, can’t be the same,
He did exactly like the drug dealer claimed.
BUT WHERE IS THE FAME,
HE WANTED SO MUCH.
If he thinks he deserves it,
Think again, not believing your luck.
There are other ways, which he could get friends?
Give me a second; he should have used his head.
Now staring down on the scars he regrets,
The numbness will never leave his body,
Slowly as his head changes colours,
He went to deep sleep,
The sleep where one can’t be woken.
Congratulations, my sleepy head,
Now you’ll be remembered, recognized.
Isn’t that what you wanted?
Or maybe in a different way,
Wouldn’t it be better getting a job than laying this way?
Rather than how you handling your parent this way.
But what could you do,
When everyone around
Has been doing the things that they call
“Popular.”
Not necessary to fit in,
When you are hurting yourself.
Be a team on your own,
It’s lonely, but, it’s the only way to protect you.
Hearing about the break ups,
The hook ups, the crowds
The girl friends and boy friends,
Can’t have one, that’s no shock.
He is laying dead, some where,
Look at what these people have turned him,
Living a life in high school, not easy."
0,"In heart, in thought, in mind
If I hope for
I love;
If I find,
I am lucky;
If in true way
I spend my short life with I love,
I am successful;
It is true love I claim
As flower it does bloom
Spreads beauty and purity
Around its branches
Then at far distance;
Raises me over wrong
Keeps me far from sin;
It knows my existence
It knows my soul,
With it I am whole
Without it I am empty,
It shows me right way,
Absolute path
Nothing after that;
It is my happiness
It is my soul's ambition
It is my soul's salvation
It is my final contentment;
For this love I will sail far
Crossing all the oceans
All the dangers
Over there;
Follow it all the loves
To make me real lover
And forever,
Come every moment
Every day
Every month
Every year
Every era,
On the way
I go pass,
Shake my right hand,
I stand,
Turn around,
I find
Love
True love;
Now I feel immortality
True love dismisses mortality
Here
And hereafter
Nor for being emotionally feat
But true at day light.
Copyright © Muzahidul Reza │11 February,2018"
