creator,poem
0,"Secret of success lies
In one's ability to collect
The scattered energies
And channel them singularly
Towards one focused goal."
0,"A train of thought lost in the desert
Crashed on the tracks, while dripping out decisions
Which ran like butterflies
from the scene of a crime
Then words escaping, from earth quaking
Aftershock tore up Metaphors and allegories
Puncturing the reverb of the chromium parietal
Restart the engine with an artistic bandage
Took to meditating on a river
where I was fishing for a poem
With a diamond coloured spatula
When it jumped over my head into the forest
Evolving from a minnow into a whirlybird plane
that went through the clouds the led to the door
That went through the eyes
Of an ebony goddess
Whose lips were an enchantment
From a fiery catchment that she got from her father who was a
Voodoo Priestess who worked at the counter of a 7 /11
In Tucson Arizona, selling slurpies to teenagers
with terrible acne and who were friends with a ginger
with large ruby dimples
and who practised Kid Magic
from dungeons and dragons
that he trained on a bum who lost his legs in the war
and regrew into a centaur that re-examined his life
getting a licence as a real-estate agent, selling homes
in middle class suburbs where fluttered the noises
of faraway cities that eclipsed the distance
standing as columns of cavernous citadels,
Etched with in lime and volcanic basalt
You could see it half away in the form of a globe,
Tip it over and outpoured the wings of a poem
Unleashed as a phoenix with wings of a thesaurus
And as I searched for words of expression
It came fluttering in as a wrapped up present
and said to me;
'You cannot search for something that was already there'"
0,"Where tiles and the roof meet each other
they did build a nest from grains of mud
to hold the small ones safe
and with the neat building work I am astonished
and I wonder from what offspring they do get the mud
where I do constantly look at those small birds,
just before the rain do notice their antics in the air
when they swish to and thro and they do turn around and around
but when the blue-white thunder does sound ominously,
both do quickly swish to their nurturing-place,
are out of the wild stormy-wind when drops do fall,
are covered in their own small fortress
and like this the God of the universe also covers us
draws us close in His embrace like children.
© Gert Strydom"
0,"Old Love
What love means to me is
a partnership of trust,
a merging of souls,
commitment a must.
It's not about ownership
or archaic vows to obey.
It's about loyalty, fidelity,
and sacrifices we make.
What love means to me is
a meeting in the middle.
Two souls functioning together,
both opposite, yet equal.
Like the motion of waves
love waxes and then wanes.
First, romance and excitment
then conpanionship gained.
What love means to me is
how you season the weather
surviving imminent tempests
then cuddling together.
Companionate love
is the ultimate goal
a love that means comfort
a love that's grown old.
what love means to me is
an assured kiss goodnight
from my best friend and lover,
on the left, to my right.
©2008 Dawn Slanker"
0,"The weather has gotten very nasty
And it's causing a lot of heartache.
It's raining dogs and cats!
And tornadoes are leaving just destruction on their wake
The weather conditions are so bad
They're bringing death and making a lot of people sad,
With all the death and disaster they have left just behind
Because of their houses, there's nothing left they can ever find
The severe weather is causing plenty of tornadoes, and floods,
And the wind starts to blow dreadfully, turning the ground below into a chaotic mud.
It's raining dogs and cats!
And tornadoes are leaving just destruction in their wake
Folks might be terrified but they always have a courageous spirit, they are hurting
Right now and in their hearts they are mourning for all they have lost without a warning,
But life continues, some folks will go away, but some come back and start over again,
As life just goes on, rain just stops and the sun will shine again, thru each road and little plain
The weather has gotten very nasty
And it's causing a lot of heartache.
It's raining dogs and cats!
And tornadoes are leaving just destruction on their wake."
0,"I want to write always in free verse
In free verse there is no pressure.
I do not want to keep any goal
I really do not want any roll
I also do not want to play any role.
I want to see this earth free from hunger
Free from poverty and I do not want to
keep anybody within an artificial boundary.
I want to write always in free verse
I want to move freely from place to place
To see people in various glaze."
0,"(in answer to Marius Absalom)
I smell the rain that pours down and keeps falling on the wet ground
when a lightning-bolt does come down blue-white in the concrete jungle,
but everywhere small groups of people stand around in the alleys
and I would escape back to the rural countryside if I could
while neon-lights keep advertising all kinds of things
and slowly I take step after step while evil does hang over the city,
the stars glitter far away above the lights and busy traffic
while I do long for better days and back to my childhood days
and there is a gambol, music and lights that drone and hum,
young people everywhere together do laugh happily and its dark night
and when a dark figure comes nearer and my heart skips a beat,
for danger I am ready and do expect the worst
but in a black leather jacket a much older man walks past
while the eternal longing for peace and tranquillity do remain in my heart.
[Reference:""Verlange"" (Longing)by Marius Absalom.]
© Gert Strydom"
0,"The sea had shown me mercy
Purple twilight hid my angry, heart-break tears.
The pink horizon shimmered across my dreams.
Dreams lay abandoned on an island of woeful fears.
Purple twilight hid my angry, heart-break tears.
My heart ached to paint paisley waters of love again.
Dreams lay abandoned on an island of woeful fears.
Perfumed passion waned; I was marooned, without you.
My heart ached to paint paisley waters of love again.
I stood looking out at the sea as her waves frolicked.
Perfumed passion waned; I was marooned, without you
Roar of the sea echoed your laughter; your smile haunted me.
I stood, looking out at the sea as her waves frolicked,
All around me, I saw shadows of your perfect face.
Roar of the sea echoed your laughter; your smile haunted me.
Clouds of loneliness invaded my space at nightfall.
All around me, I saw shadows of your pefect face
Why was I abandoned, on this island of desolate longing?
Clouds of loneliness invaded my space at nightfall.
Who will find me, lost here, within this pitty-full shell?
Why was I abandoned, on this island of desolate longing?
I was awakened by an invasive early bright orange sunrise!
Who will find me, lost here, within this pitty-full shell?
I turned to run away from the intrusion of sunrise screaming!
I was awakened by an invasive early bright orange sunrise!
A smile from within me cracked the walls of dismay.
I turned to run away from the intrusion of sunrise screaming!
Upon the shore a precious pearl spilled, resting at my feet.
A smile from within me cracked the walls of dismay.
The pink horizon shimmered across my dreams.
Upon the shore a precious pearl spilled, resting at my feet.
The sea had shown me mercy.
Dorothy Alves Holmes
A Poet Who Loves To Sing"
0,"Straight-backed upright the suricate sits on the anthill and watches the world
with small sharp eyes it's cut fine where it looks at the sky and ground,
as life can in one single moment totally stop,
an eagle can dive down or a predator could hunt where the others do dig
but nothing moves on the plain or is to be seen in the sky,
it's only heat waves that in the summer-sun do tremble
and the watcher looks ahead, to and thro and back again
where everything around him is living in abundance.
He becomes aware of a caracal sneaking nearer in the grass and do shrill,
in all direction to holes suricates do scatter
but then the veldt and everything is suddenly deadly silent
and forward on soft paws the sly cat sneaks
while every suricate waits deep down in the burrows,
while a babbler high up in a tree laughs at the world.
© Gert Strydom"
0,"When language is used for expression
Words will improvise
Here comes an expert who is so smart
Devises a complex pattern
And hits us with a baton!
The poet cries....
His heart doesn't abide
The tears guide....
And poetry is revolutionized."
0,"Whenever I hear birds singing
As I walk under tall, green trees
I shall think of you and smile
Whenever I hear a sweet wrapper
Rustling gently in the breeze
I shall remember you and smile
Whenever I long to hear the sound
Of your infectious, joyful laughter
I shall miss you always and smile."
0,"Free Verse Version
This big ole egg named Humphrey
was perched on the top of
a high brick wall.
He fell off
It was a long way down
and he shattered his shell.
Someone call 911!
All the King's lackeys came with
a herd of emergency tech horses.
They tried to glue ole Hump
back together
but no luck.
Too many pieces
Tough grits!
Original Version
Humpty Dumpty sat on a wall
Humpty Dumpty had a great fall.
All the King's horses
And all the King's men
Couldn't put Humpty
Together again.
Now I ask you.
Which version is better?
I kinda like the first one
How about another?
This shepherdess'
name was Bo Derek Peep
called Bo for short.
Somehow she
misplaced her sheep.
She looked high and low to no avail.
She didn't know
where else to look
so she just went and
had herself a brewski
and they eventually returned on their own
to the sheepfold
and they wagged their tails
in the back.
Where else?
You know the original so
I will not repeat for you."
0,"Beauty with envy and hatred
Is not beautiful at all
Here beauty is real
Beautiful is false
As beauty is heavenly
Envy and hatred are helly
To be beautiful
Need free from envy and hatred above all.
Copyright © Muzahidul Reza | 08/04/2017"
0,"(free verse) *Strictly For The Birds
I can tell when my cat has been chasing ducks.
He has that down-in-the-mouth look.
Which birds steal soap from the bath?
Robber duckies
When vultures fly are they allowed carrion luggage?
A raven has 6 pinions on each wing
A crow has 5 pinions on each wing
So the difference is a matter of a pinion
* free verse... prose on a poem site"
0,"Is it just me or does time seem
To move faster the older you get?
It almost feels like the world is
Moving too quickly and I must
Move with it or be left behind,
For the world waits for no man
I can remember back to when
I was much younger than I am now it
Doesn’t seem that long ago, does it?
Perhaps it does, but I’m not certain
I can remember things, things that
Seem like they happened yesterday
But they don’t seem real somehow
The person in those memories is not me
Well, at least not the me that I am now
I have changed, the endless march
Of time has made sure of that but
I am not sad and I am not bitter
I have become a husband and a father,
And because of those precious gifts
I long to know what other beautiful things
I may become with the turning of the world;
But even the wonderful blessings which
May come in the years ahead make the
Speeding of time no less strange or frightening."
0,"Dream on with your life,
Keep dreaming because you’ll,
Never get this back,
Dream on till you can’t dream no more,
Because when your done dreaming
I won’t be there no more,
I will be long gone,
Not thinking of you,
So dream on till there are no memories left, ,
I don’t want to be caged,
My heart tells me it wants to be free,
Not locked up in one spot,
Dream on with your life,
Go find someone new,
Don’t bother with me anymore,
Because I’m long gone by now,
So Dream On."
0,"She is so proud of her beauty and color
That I want much adoring her
She keeps her at far in a sweet temper
As she is seen in the picture,
But when I return from outside
She touches me with her body and tail
To attract me to demanding care
Sometimes she hugs me by my leg
To complain any body's misbehave,
She is my adorable pet cat
Whom I am fond of very much, thus
A mutual fondness has developed
As she follows me even at midnight
To obey any dear command."
0,"How I yearn to write in free verse,
Free from rhymn, cadence and
Free to roam about ethereally,
In some never-never land.
The muse of Erato is upon me. I have an urge,
an urge to write with vagueness and abstraction,
to cloak my meanings in surrealism and mystery.
Perhaps, I could write of passion, joy, sadness,
despair, longings, angers, envies and doubts. I
could write of depressions and elations, using
platitudes and beatitudes. I must write of sad
yesterdays and hope-filled tomorrows and tell
of my misty dreams and future schemes. Ah! -
Yes, these would be good topics, free from the
shackles of rhyme. My sucess depends on your
ability to interpret what I have written. I may yet
become the Picasso of poetry.
But when I take my pen in hand
To write new poetry,
It still comes out in rhythmic form,
Dear Lord, please set me free!"
0,"Beauty with harm
Is not beautiful at all
Here beauty is real
Beautiful is false
As beauty is heavenly
Harm and to be harmful are helly
To be beautiful
Need harmless attitude and to be beneficial.
Copyright © Muzahidul Reza | 08/04/2017"
0,"Your land is dry, barren and hard
And going to be desert
How will you make it cultivable?
Have you water?
Water is power
Not only to humans, animals, plants
But to land
Our life is dependent on all these.
Copyright © Muzahidul Reza| 24 November,2017"
0,"A beautiful girl
Patiently waiting for something
In the warm bright sun
Now walks
Onto the street
Where cars rush about
She is hit and a crowd gathers around
Her corpse rises from the centre of the crowd
Turns to me and whispers
“Watch your step…”"
0,"(after Ina Rousseau)
Where each one of us stands on the stage of the world,
where our own lives are a scene before the universe
on a earth full of great darkness
Your bright searchlight does cut its own way,
each person's turn does come to go on
and the great secret of the spectacle
brings to everyone a unique meaning
where some do loose their lives for You,
like a player in a leading role or just a figure
do play out their roles for the last time,
others do unexpectedly disturb the lives of others,
do lead them off the road running to the other side
and the time is running out before the curtain does fall
while You do still perform as the big director.
[Reference: ""Kwatryne"" (Quatrains)by Ina Rousseau.]
© Gert Strydom"
0,"Running through the dark
lights and trees whipping past.
Claws shred the earth
and fur blows in the wind.
Fangs drenched in blood
my core burning in rage.
Wolves are extremly loyal
but just as posessive as well.
I'm her pet and she's
MY master as well.
curling at her feet, it feels nice.....
to be so close.
I nudge her leg gently with my muzzle
and look up into her golden eyes.
I'm happy she cares about me....
So rare...
Night is my domain
and my mistress."
0,"(Love Never Ends: Free Verse)
Once you love truly
Then see, never ends
In all stages of life it exists immortally;
I say, ""I love, I love"", if it is in heart
Happy or sad heart bears it forever;
I am here, I am there,
Nothing matters
It follows everywhere,
Every path it crosses
Even, uneven, chaotic, full of thorns
Up to reach the destination,
On the way it may be hurt
But does not get death, anyway
Like soul love is unseen
And fully immortal,
You love really
It will make you believe definitely,
After hurt it will ferment
Will get much vigor, power
Then at destination
It becomes heavenly one
And never ends.
Copyright © Muzahidul Reza │9 March,2018"
0,"(free verse) *Books Not Recommended For Kids (part one)
""Things rich kids have but you never will""
""The little boy who died from eating all his veggies""
""Fun four-letter words to know and share""
""Curious George and the high-voltage fence""
*(free verse ... prose on a poem site)"
0,"The high moors lie beneath a changing Sky
As seasons in their turn assume the throne
The landscape changes yet remains the same.
Cosmetic changes superficially
appear to alter what is permanent.
Changing perceptions of what we can see
by adding or subtracting colouring
The pleasant shades of green wrought by the spring
The hues of summer heather dominates
and autumn paints the moors in shades of gold.
Then winter shows monochrome artistry.
Uninhabited. uninhibited
The high moors appear to be desolate
and yet sustain more life than meets the eye.
The circling hawks on high can see their prey
and stooping, swiftly expertly they dine.
They take some small life to sustain their own.
Obeying Natures rule kill or be killed.
The high moors can be very dangerous
especially to the uninitiated.
Their beauty attracts both wise men and fools.
And yet there is no place I’d rather be
Alone, or with congenial company.
13-Sep-08
http.blog.myspac e.com/poetic piers"
0,"I admire all the aims of Free Verse,
‘tis explicit in all that I do
in shaping the stress to converse
with a rhyme-scheme restricted to two.
That I stay with this number is true, -
a linguistic abuse, maybe worse,
how it weighs and encumbers the view! -
but French art needs its aid, though perverse.
Else the Muse would be dumb to a curse,
for to accent, the lingo’s deaf too, -
though what can one do?  All’s averse
to fantasy rhyme calls on cue!
May Free Verse’s aims bring joy unto
the young sparks who chance meanings coerce -
whose mental gymnastics’ fun value
is the fire to inspire hopes they’d nurse.
They’re young colts who green pastures traverse
with gravity worthy their virtue,
though mad they’re superb, and no hearse
they’d inherit! Free Verse tempts!  You too?"
0,"My blood-shot eyes blink away existence
Unfamiliar voices roll through my brain
Gravity’s unseen hands pull me to the earth
I find their spell far too charming to fight.
Awful bells start to toll in my head, they play
Their terrible tune of death, so seductively
A searing light of pure white beats at my face
As the tolling draws me closer to it’s calling.
I ascend into a white tunnel shining above me
But my body stays on the cold, hard ground
I’m so free from the burden of my fleshy clothing
So naked and fragile, like a screaming newborn.
My heart’s rhythmic beating calls to me longingly
I fall back into the warm sanctuary of my body
I take a breath and feel so blessed  to still be alive
But all I can think about is the searing white light."
0,"When you think and feel
in terms of iambs or trochees
and sing them in series within,
you feel the pulse of a regular
rising or falling rhythm.
The recurring feet or beats make the lines
monotonous or surfeiting;
may be dull and flat at times..
The increasing anapaests
Makes  the movement fast
But dactyls keep the tempo slow.
The epics and long tales of the past
with thrilling and grilling events
recharged our minds to linger long
in tasting of those sonorous lines.
You pen the shoddy lines
of words and phrases you think,
with a natural mix of humour and rhetorics
images and word-music
in long end-stopped or short enjambed ones.
Free verse lines of syncopation
blossom out of syncronised patterns
to sing the beauties of the mundane
and supreme things."
0,"Forty word poem.
'Lowell-Lowell' the poets did say
When Industrial Revolution came to stay.
Concord and Merrimack flowed merrily,
Birds singing songs, children at play.
'Sword Blades and Poppy Seeds'
was Poem of The Day. Life seemed
so gay down Massachusetts' way."
0,"Sadly, to me
This thing they call Prose
Is naught but just talk,
And often verbose;
I think it's too easy
And honestly, I'm
Just wanting to say
I much prefer rhyme.
And almost the same is the
Form called Free Verse,
It isn't for me, I'm not keen,
And what's worse:
Explaining the differences
Should be a breeze,
But even amongst the 'experts'
No one agrees.
Now I'm no academic
But I won't be fooled
By the 'cleverer' people,
By the so-called, 'well-schooled';
I favour good rhyming
O'er Free Verse or Prose,
And I'm calling to mind now
The Emperor's New Clothes."
0,"Consummate pain
Like a cruel wrench
Gripped his heart
And crushed, it bled
A father's tears.
No words define
His anguished grief
A wretched loss
His own son...
His seed.
The baby he carried
In his arms
And nurtured
In paternal love
Now broken, scarred
A shriveled man
His father's eyes
Now bleed.
He would take him back
To be his child
Return him safely
To his past
No war could touch him
Hidden there
His eyes see through
An hourglass.
My boy, my son!
What have they done?
Your life a mangled mess
What's left to do?
These father's tears
Will not replace
The boy, the man
That I once knew!
-
May 12,2009 Tarlac City Philippines"
0,"(after Lucas Malan)
What does a person know about the man that stands at the traffic light
in the hot sun away from the shadow of the trees in the lane
with a board in his hand on which he is begging for money and aid
and many think that he is too rotten to work and so his life does go on.
The religious zealots or the colporteur that knocks at the door is the one
that everywhere does dare his life against dogs that want to tear him apart,
do want to set a view of God to you or do want to sell religious books,
do sometimes want to warn the entire world about what is about to happen
and if Jesus Christ in person does come to have a friendly conversation,
shyly like a boy walks to the front door and do come and ask
for water and you see that He is carrying many miles
will you recognize Him and do your door swing open wide
or do you show Him away like all of the others
and shout:""get out of your own mess by yourself! ""
[Reference:""Gesante"" (Envoys) by Lucas Malan.]
© Gert Strydom"
0,"(for Annelize)
I adore you late at night, at daybreak and in the afternoon,
even if the days of hardship would come without an end,
even if all of life did only flower as thistles
it would do nothing to my love for you,
even if I had to reconcile myself with another person in your life,
for years you will still have me speechless
where I do love you still in my later years
as love do not set demands to fulfil,
it only leaves its own lovely tracks deep in the heart
and like the seasons nothing can stop it
where it lasts for decades and go far past the aeons,
it brings healing and happiness instead of sorrow,
it is something that do includes all great things and also hope
and with my love I want to envelope your whole world.
© Gert Strydom"
0,"I had been lost deep into the big city,
in alleys circling almost endless around me
with only the fuel fumes
hanging almost cuddling around.
In alleys circling almost endless around me
I could not find my way in the darkness
hanging almost cuddling around,
I could not even see the stars.
I could not find my way in the darkness
with only the fuel fumes,
I could not even see the stars:
I had been lost deep into the big city."
0,"A moving tree having various sections of branches
Of hope, despair, success, failure, vices and virtues
That inwards roots and outwards the saplings grow
With a course in mysterious way of moving to and fro
Through rough, plain, desert, forest, ocean, mountain
Straight, curving, zigzag, back-forth and up-down;
With all the liking-disliking colours−
White-black, red-grey, yellow-blue and ash-green
With some inevitable weathering facts−
Summer, spring, winter, autumn and late autumn
With some mixing emotions and temperaments−
Liking-disliking, loving-hating, laughing-crying
With some destructive and breath choking vices−
Envying, spoiling, shooting, bombing, killing
Again with some angelic qualities−
Praying, helping, making, thinking, inventing
With all there are some unavoidable plights−
Beginning, romance, curious, fierce, tumultuous
Mid, fit, unfit, calm and ultimate ending
Without noticing, informing, testing or warning.
Copyright © Muzahidul Reza |11/9/2016"
0,"(after Etienne van Heerden)
As a child he was taught that the judgement day of God would come,
of angels that do hold a laager of protection around him,
where the pastor and Sabbath School of the church said
that God's territory is everywhere and limitless
and he believes that he serves the Lord sincerely and faithfully,
that God does even witness the smallest injustice on earth,
do shoot with his catapult the mynahs to death
where they peck at the other birds like demons that some feathers are lost,
do hear the babbler roaring with laughter at him
and believes that it's a message coming from God
that right and righteousness must occur everywhere
as the world is the jurisdiction of God
where the doves again sing their songs of praise,
of a God that do even to birds bring salvation.
[Reference:""Seun in rietbos"" (Boy in a reed-bush) by Etienne van Heerden.]
© Gert Strydom"
