creator,poem
0,"In womb I was fed on the extraction of her body
I played, moved there wether night or day
She bore me with great care
She more thought of me than other
About how I would be
When I might come on her lap
What she would name me
How she would rear me up;
At last her waitness came to an end
On a favourable day l came
She forgot the pains from she suffered
The eye balls of her I became;
How much love, care, adore are in the earth?
All she brings and inserts on me
She overcomes all difficulties of me
From womb to the last she does breathe;
I have observed at adolescence
I have remembered her presence
None is like mother how may be they our
Mother is just mother none is like her
However she is to all other
To me, after God is my mother."
0,"(free verse) *A Message From Space
Spick! ...Spick
This is Captain Cork ...
The universe is leaking
Put the olive back in the bottle
(free verse.. prose on a poet site) *"
0,"(after Elisabeth Eybers)
You ask that I must again turn back with a gesture,
must go away from that which is safe and secure,
that I must accept changes in you and your family
and that everything does remain the same is no secret,
where you do expect that I have got to forget everything,
must come and face a similar lifelong barrage,
where I know of the breaking down of my humanity:
that your people do not even respect or regard me as a human being,
where you did bring about and speak out the end of our relationship
and then it was with you and your people's deeds night to me,
but now you do want that I break my intentions with someone else
as if there still remains something between us, you do expect:
that after all of this no change has come
and here I stand totally confused and astonished.
[Reference:""Sonnet.Al wat jy vra is net die klein gebaar"" (Sonnet. All that you ask is only a small gesture)by Elisabeth Eybers.]"
0,"Fruit juice
Suitable for health,
Gives vigor
In figure;
Extractions of
Harmful ingredients
Chemicalized and
Fermented
As damn the health
So damn the soul.
Copyright © Muzahidul Reza │13 January,2018"
0,"I somehow seem to always comfort others with the words I want to hear
I hear myself telling people to stay srtong
And to hold on to what they love
And to let go of what is hurting them
And to work hard to earn what they want
And that everything's gonna end up just fine
And that eventhough it feels like the end of the world, it isn't
But when it comes to me
I'm the weakest person on earth
And I push what I love away because I fear getting hurt
And I hold on to what I know is of no good to me
And I expect to get what I want without working for it, but I don't, so I'm left with nothing
And I know for a fact that nothing really gets better:
I just get used to the situation I'm in
And the end of the world is basically every single night I'm alone with my thoughts
I've come to a conclusion that I crave seeing people being good at the things I'm bad at
I try my more than best to ensure the well-being of others while my own happiness is just an act so those I'm helping don't feel like there's something wrong
It's because I know what being down, being rejected, being hurt, and feeling worthless feel like, I don't want anyone to feel like that
I am not asking for your sympathy
I am not asking you to tell me words of comfort
Because this will only make me feel worse
And please, if you are going to say something, don't tell me that things are gonna be okay and that there is a light at the end of every dark tunnel
As I've said before, nothing really becomes 'okay'
And I know that every tunnel ends with a light
Just let me keep on doing what I'm doing because helping ones who have no one to hear them out or those who feel depressed or that nothing is right helps me, too, somehow
I think that by trying to understand others, it's one step closer to understanding myself
And in solving others' problems I find solutions to my own
I believe that the first step to knowing oneself is knowing others well as to discover what pleases or angers you and change your life to what suits you most"
0,"Simply the mind can not be idle
And it kicks the heart bullying
The heart cries, the mind giggles
And the mind starts singing
In all tones in all colours of lexicon
Stunned heart mutes its cry
And the mind and the heart both sing
Freely freely free verses"
0,"Beauty with immodesty
Is not beautiful at all
Here beauty is real
Beautiful is false
As beauty is heavenly
Immodesty is helly
To be beautiful
Need modesty to be modest above all.
Copyright © Muzahidul Reza |08/04/2017"
0,"Old generation goes
New generation comes
Hold them tightly in hands
Caress them properly in minds,
Teach them things they need
Make them gently mannered,
Leave things well for them
Don't leave them at dark
But leave them enlightened
They are tender hearted
Leave them not on stone
They are our new generation.
Copyright © Muzahidul Reza | 30 October,2017"
0,"An excellent piece of modern poems
Full of darkness, chaos and trash
Of war, horror, terror, destruction
Violence, crimes, corruption, oppression
Depression, deprivation, frustration
Snatching, robbing, raping, wrong doing
Abducting, killing, cutting, firing, burning
Bombing, massacring, occupying
Torturing, tormenting, spoiling, damaging
Forgery, hypocrisy, lust and all ill forces mixed.
Copyright © Muzahidul Reza |12/24/2016"
0,"Clearly seen and truly said something
Not of nature but of human being,
Of their claiming big by brain
But showing majorly wrongs in doing;
Inventing dreadful chemicals and arms
They raise random wars to massacre,
Illegally charging any race or nation
Dishonor, murder and destroy to finish;
These are some fatal signs of being
Fool in abusing but wise in nothing,
Committing injustice, crimes, corruption
Being really hypocrite show outwardly fit.
Copyright © Muzahidul Reza | 10 November,2017"
0,"In the black townships the days and nights clatter pass
while mini-bus taxis are constantly at war
with every bus and train and do protect their routes with murder,
they shoot with AK-47's as they do drive pass
where this country is now free from law and order,
where things everywhere do only become weaker and do deteriorate
and for nobody there is respect or consideration
when Lucifer gets his claws into everything
and in the lawlessness do stick out his dark fingers
where white educated and qualified people are unemployed,
hordes of others do strike and even at universities do demonstrate violently
while criminals do merciless torture, rape, murder, rob and break
and God's mercy, His love do lack in the hearts of people
while Lucifer and his darkness is in the heart, the mind and eye.
© Gert Strydom"
0,"Empires are like the vast waves
Upon a never ending ocean of time
They start off humbly before rising
Out of the gloom of their origins.
Forever reaching up towards the
Sacred searing light of the heavens
Searching for a promise of power
That is never found, or fully realized.
Those that bare witness to it can
Only marvel at it’s sheer decadence
And it’s raw, unlimited power which
Drives it’s endless, unsatisfied greed.
As quickly as it appeared it sinks away
Into the oblivion of the darkness which
Gave it birth, only for another to follow
In its wake, thus the cycle goes ever on."
0,One can only hope that no one hands him a violin
0,"Hollow-eyed shades
of human beings,
human beings
cogitating on jazz music,
jazz penetrating the silence
of the bleeding angels,
angels in a fight for
the awakening of this blind reality,
wars,
racism,
asylums,
prostitution,
anxious women,
terrorist attacks,
public executions,
illegal immigration,
dengue fever, songs, low wages,
Zika and Chikungunya viruses,
human cells combined with mammal fetus,
monetization of the objects
emblazoned clothes &  precious stones,
Islamist militancy,
meteorite impacts,
vegetation fires,
crucifixions,
kidnappings,
sphinxes,
crimes,
drugs,
cocktails,
birth defects,
huge ocean waves,
ISIS strategies,
sexual harassments,
sales of stolen artifacts,
multiple vortex tornadoes,
quakes striking near the plate boundaries,
children murdered in egregious crackdowns,
food securities for starving people,
changes in refugee policies,
landslides, Monsoon rains and flash floods,
seasonal unemployment,
nuclear disasters,
smiling volcanoes,
price increases,
naked bodies,
hairstyles,
dreams,
cubes,
glasses,
gas stations,
interim work,
glacier calving,
protests blocking the roads,
new theatrical triumphs,
ill kids not displaying symptoms,
macroeconomic policies,
silent strategies of democracies,
different drivers having
different styles to run their cars,
cars blinking their headlights
while their motors scream,
screaming trees and revolvers
that shoot up walls to write lyrics,
lyrics of jazz penetrating the silence
of the bleeding angels,
angels in a fight for
the awakening of this new reality.
Poem by Marieta Maglas"
0,"Beauty with fornication
Is not beautiful at all
Here beauty is real
Beautiful is false
As beauty is heavenly
Fornication is helly
To be beautiful
Need preserve chastity above all.
Copyright © Muzahidul Reza | 08/04/2017"
0,"(for Annelize, after A. G. Vissier in answer to André letoit)
I met you at college
and always you did greet me with a smile,
you were my own prophetic Letitia
and your lips and mouth was sugar-sweet
where the way that you did look at me,
how happy and beautiful you were
did predict my future, my love with you
and all the ways were open and even,
our love was something big and unique
with the sun in your eyes and I were constantly admiring you
as a Letitia euphoria
in a stretched out summer days with a very late sunset
but now that I do know you through and through
I do once more try to win your heart.
[References: ""Letitia"" by A. G. Visser.""visserman"" (fisherman)by André letoit.]
© Gert Strydom"
0,"Beauty with pride
Is not beautiful at all
Here beauty is real
Beautiful is false
As beauty is heavenly
Pride is helly
To be beautiful
Need prideless dealing with all.
Copyright © Muzahidul Reza | 08/04/2017"
0,"Weavers do twitter, warblers chirp and doves coo
and the summer overflows with joy
but for the cat that do try to murder the birds
where from the branches of the fig tree the birds peep
and in the days of the summer I am swept away
by all of the birds that so cheerful do sing in their choir
and do notice them splash and drink at the water bowl
when they do flutter down and I do feed them crumbs
and every bird does sing an own love-song
that continually does sound up with joy
as if all of creation do enjoy this summer,
the birds land as if the fruit trees do beckon them,
know that they do offer seed and fruit to them
and I can think of no other better summer."
0,"Beauty is God
In words, in creations
Beauty is truth
In nature, in thought
Beauty is virtuous soul
In innocent, in saint
Beauty is integrity
In honesty, in sincerity
Beauty is legality
In power, in justice
Beauty is love
In reality, in humanity
Beauty is deeds
In doings, in done
Beauty is life
In properly spend,
Let's think of each
To beautify in and out of us.
Copyright © Muzahidul Reza |12/24/2016"
0,"(for Annelize, in answer to Daniel Hugo)
Your sunny glance is brighter and more cheerful
than the riant suns, moons and stars in the universe
when your smile do draw people during the day and night to you
and over you and with you I am infatuated, in love and totally crazy
where truth as utterly bright light do get meaning in you
as if God is present in your heart, spirit and soul
where as a human you do moment by moment make me happy
where the depth of love as open and plain for all to see
through God becomes immortal as something eternal between us
where He keeps giving the sincere truth and selflessness
when I pour out myself, my hart, spirit and soul and everything into you
and we as mere humans do enter something godly and inhuman
where the yearning of the flesh, body, soul and spirit
becomes one composition of the two of us without any fear.
[References:""Leesverslag"" en ""Lyfmistiek II"" (Reading report and body-mysticism)by Daniel Hugo.]
© Gert Strydom"
0,"Free verse it must not be that easy for to write
And not very easy for one to recite
Harder by far to pen good free verse than to pen good rhyme
Which was popular going back four decades in time
So many fine poets writing in free verse to day
Into the twenty first century they lead the way
It does seem in poetry rhyme is of the past
But few things in life ever does seem to last
In literature many more changes ahead
In a few decades from now free verse may be dead
For most things upon them have a use by date
And the passage of time on few things seem to wait
Times changing faster nowadays than ever before
And only Nature herself will live forever more"
0,"From the pit of my coldness
You burn me with acid-filled glares
Like I am nothing but garbage left to go stale
Out here I have no shelter from the rain.
I wander hungrily through familiar streets
Looking for somewhere to belong
I am labelled as a leper amongst the sick
For you do not want to see or hear my pain.
As I stand in the doorway of my despair
I watch the world from it’s shadows
I have become a phantom with no hope
For I have ran out of people to blame."
0,"From this city I want to flee,
to find a place of some solace,
not again I want to return,
where city lights sometimes blind people.
I still think about how it was,
from this city I want to flee,
I cannot fit in this anthill,
a bridge to escape, I must find.
The city makes me uneasy,
I want to wander on the beach,
from this city I want to flee,
I want to vanish by bus or train.
Now I splash in a city stream,
at times are in the open air,
about freedom I can just dream,
from this city I want to flee."
0,"Beauty with cruelty
Is not beautiful at all
Here beauty is real
Beautiful is false
As beauty is heavenly
Cruelty is helly
To be beautiful
Need avoid cruelty above all.
Copyright © Muzahidul Reza | 08/04/2017"
